{
  "task_id": "T-fx-vonly",
  "from_agent": "fixture-producer",
  "to_agent": "verifier",
  "goal": "Synthetic: verify these claims.",
  "status": "requested",
  "inputs": [],
  "constraints": {
    "revise_loops_left": 2
  },
  "claims": [
    "C-v1",
    "C-v2",
    "C-v3",
    "C-v4",
    "C-v5-ghost"
  ],
  "created_at": "2026-10-07T12:00:00-04:00"
}